{
  "$schema": "https://json-schema.org/draft/2020-12/schema",
  "type": "object",
  "properties": {
    "schemaVersion": {
      "type": "number",
      "const": 1
    },
    "yearOfAssessment": {
      "type": "string",
      "pattern": "^\\d{4}\\/\\d{4}$"
    },
    "period": {
      "type": "object",
      "properties": {
        "from": {
          "type": "string",
          "pattern": "^\\d{4}-\\d{2}-\\d{2}$"
        },
        "to": {
          "type": "string",
          "pattern": "^\\d{4}-\\d{2}-\\d{2}$"
        }
      },
      "required": [
        "from",
        "to"
      ],
      "additionalProperties": false
    },
    "status": {
      "type": "string",
      "enum": [
        "proposed",
        "enacted",
        "superseded"
      ]
    },
    "lastReviewed": {
      "type": "string",
      "pattern": "^\\d{4}-\\d{2}-\\d{2}$"
    },
    "sources": {
      "type": "object",
      "propertyNames": {
        "type": "string",
        "minLength": 1
      },
      "additionalProperties": {
        "type": "object",
        "properties": {
          "title": {
            "type": "string",
            "minLength": 1
          },
          "file": {
            "type": "string",
            "minLength": 1
          }
        },
        "required": [
          "title",
          "file"
        ],
        "additionalProperties": false
      }
    },
    "reliefs": {
      "type": "object",
      "propertyNames": {
        "type": "string",
        "minLength": 1
      },
      "additionalProperties": {
        "type": "object",
        "properties": {
          "amount": {
            "type": "integer",
            "minimum": 0,
            "maximum": 9007199254740991
          },
          "appliesTo": {
            "minItems": 1,
            "type": "array",
            "items": {
              "type": "string",
              "minLength": 1
            }
          },
          "src": {
            "type": "string",
            "minLength": 1
          }
        },
        "required": [
          "amount",
          "appliesTo",
          "src"
        ],
        "additionalProperties": false
      }
    },
    "qualifyingPayments": {
      "default": [],
      "type": "array",
      "items": {
        "type": "object",
        "properties": {
          "id": {
            "type": "string",
            "minLength": 1
          },
          "cap": {
            "type": "integer",
            "minimum": 0,
            "maximum": 9007199254740991
          },
          "rate": {
            "type": "integer",
            "minimum": 0,
            "maximum": 10000
          },
          "src": {
            "type": "string",
            "minLength": 1
          }
        },
        "required": [
          "id",
          "cap",
          "rate",
          "src"
        ],
        "additionalProperties": false
      }
    },
    "rateSchedules": {
      "type": "object",
      "propertyNames": {
        "type": "string",
        "minLength": 1
      },
      "additionalProperties": {
        "type": "object",
        "properties": {
          "label": {
            "type": "string",
            "minLength": 1
          },
          "bands": {
            "minItems": 1,
            "type": "array",
            "items": {
              "type": "object",
              "properties": {
                "width": {
                  "anyOf": [
                    {
                      "type": "integer",
                      "minimum": 0,
                      "maximum": 9007199254740991
                    },
                    {
                      "type": "null"
                    }
                  ]
                },
                "rateBp": {
                  "type": "integer",
                  "minimum": 0,
                  "maximum": 10000
                },
                "src": {
                  "type": "string",
                  "minLength": 1
                }
              },
              "required": [
                "width",
                "rateBp",
                "src"
              ],
              "additionalProperties": false
            }
          },
          "verified": {
            "type": "boolean"
          }
        },
        "required": [
          "label",
          "bands",
          "verified"
        ],
        "additionalProperties": false
      }
    },
    "rateCaps": {
      "default": {},
      "type": "object",
      "propertyNames": {
        "type": "string",
        "minLength": 1
      },
      "additionalProperties": {
        "type": "object",
        "properties": {
          "label": {
            "type": "string",
            "minLength": 1
          },
          "appliesToSchedule": {
            "type": "string",
            "minLength": 1
          },
          "maxRateBp": {
            "type": "integer",
            "minimum": 0,
            "maximum": 10000
          },
          "conditions": {
            "default": [],
            "type": "array",
            "items": {
              "type": "string",
              "minLength": 1
            }
          },
          "verified": {
            "type": "boolean"
          },
          "src": {
            "type": "string",
            "minLength": 1
          }
        },
        "required": [
          "label",
          "appliesToSchedule",
          "maxRateBp",
          "conditions",
          "verified",
          "src"
        ],
        "additionalProperties": false
      }
    },
    "conditions": {
      "default": {},
      "type": "object",
      "propertyNames": {
        "type": "string",
        "minLength": 1
      },
      "additionalProperties": {
        "type": "object",
        "properties": {
          "question": {
            "type": "string",
            "minLength": 1
          },
          "ifNotMet": {
            "anyOf": [
              {
                "type": "string",
                "minLength": 1
              },
              {
                "type": "null"
              }
            ]
          },
          "evidence": {
            "type": "string",
            "minLength": 1
          },
          "src": {
            "type": "string",
            "minLength": 1
          }
        },
        "required": [
          "question",
          "ifNotMet",
          "evidence",
          "src"
        ],
        "additionalProperties": false
      }
    },
    "separatelyRated": {
      "default": {},
      "type": "object",
      "propertyNames": {
        "type": "string",
        "minLength": 1
      },
      "additionalProperties": {
        "anyOf": [
          {
            "type": "object",
            "properties": {
              "label": {
                "type": "string",
                "minLength": 1
              },
              "rateBp": {
                "type": "integer",
                "minimum": 0,
                "maximum": 10000
              },
              "reliefEligible": {
                "type": "boolean"
              },
              "verified": {
                "type": "boolean"
              },
              "src": {
                "type": "string",
                "minLength": 1
              }
            },
            "required": [
              "label",
              "rateBp",
              "reliefEligible",
              "verified",
              "src"
            ],
            "additionalProperties": false
          },
          {
            "type": "object",
            "properties": {
              "label": {
                "type": "string",
                "minLength": 1
              },
              "selector": {
                "type": "object",
                "properties": {
                  "field": {
                    "type": "string",
                    "minLength": 1
                  },
                  "thresholdYears": {
                    "type": "integer",
                    "minimum": 0,
                    "maximum": 9007199254740991
                  }
                },
                "required": [
                  "field",
                  "thresholdYears"
                ],
                "additionalProperties": false
              },
              "tablesBySelector": {
                "type": "object",
                "properties": {
                  "atOrBelow": {
                    "minItems": 1,
                    "type": "array",
                    "items": {
                      "type": "object",
                      "properties": {
                        "width": {
                          "anyOf": [
                            {
                              "type": "integer",
                              "minimum": 0,
                              "maximum": 9007199254740991
                            },
                            {
                              "type": "null"
                            }
                          ]
                        },
                        "rateBp": {
                          "type": "integer",
                          "minimum": 0,
                          "maximum": 10000
                        },
                        "src": {
                          "type": "string",
                          "minLength": 1
                        }
                      },
                      "required": [
                        "width",
                        "rateBp",
                        "src"
                      ],
                      "additionalProperties": false
                    }
                  },
                  "above": {
                    "minItems": 1,
                    "type": "array",
                    "items": {
                      "type": "object",
                      "properties": {
                        "width": {
                          "anyOf": [
                            {
                              "type": "integer",
                              "minimum": 0,
                              "maximum": 9007199254740991
                            },
                            {
                              "type": "null"
                            }
                          ]
                        },
                        "rateBp": {
                          "type": "integer",
                          "minimum": 0,
                          "maximum": 10000
                        },
                        "src": {
                          "type": "string",
                          "minLength": 1
                        }
                      },
                      "required": [
                        "width",
                        "rateBp",
                        "src"
                      ],
                      "additionalProperties": false
                    }
                  }
                },
                "required": [
                  "atOrBelow",
                  "above"
                ],
                "additionalProperties": false
              },
              "reliefEligible": {
                "type": "boolean"
              },
              "verified": {
                "type": "boolean"
              },
              "src": {
                "type": "string",
                "minLength": 1
              }
            },
            "required": [
              "label",
              "selector",
              "tablesBySelector",
              "reliefEligible",
              "verified",
              "src"
            ],
            "additionalProperties": false
          }
        ]
      }
    },
    "apit": {
      "type": "object",
      "properties": {
        "tables": {
          "default": [],
          "type": "array",
          "items": {
            "type": "object",
            "properties": {
              "label": {
                "type": "string",
                "minLength": 1
              },
              "bands": {
                "minItems": 1,
                "type": "array",
                "items": {
                  "type": "object",
                  "properties": {
                    "width": {
                      "anyOf": [
                        {
                          "type": "integer",
                          "minimum": 0,
                          "maximum": 9007199254740991
                        },
                        {
                          "type": "null"
                        }
                      ]
                    },
                    "rateBp": {
                      "type": "integer",
                      "minimum": 0,
                      "maximum": 10000
                    },
                    "src": {
                      "type": "string",
                      "minLength": 1
                    }
                  },
                  "required": [
                    "width",
                    "rateBp",
                    "src"
                  ],
                  "additionalProperties": false
                }
              },
              "verified": {
                "type": "boolean"
              }
            },
            "required": [
              "label",
              "bands",
              "verified"
            ],
            "additionalProperties": false
          }
        },
        "src": {
          "type": "string",
          "minLength": 1
        }
      },
      "required": [
        "tables",
        "src"
      ],
      "additionalProperties": false
    },
    "wht": {
      "type": "object",
      "propertyNames": {
        "type": "string",
        "minLength": 1
      },
      "additionalProperties": {
        "type": "object",
        "properties": {
          "rateBp": {
            "type": "integer",
            "minimum": 0,
            "maximum": 10000
          },
          "verified": {
            "type": "boolean"
          },
          "src": {
            "type": "string",
            "minLength": 1
          }
        },
        "required": [
          "rateBp",
          "verified",
          "src"
        ],
        "additionalProperties": false
      }
    },
    "calendar": {
      "type": "object",
      "properties": {
        "instalments": {
          "minItems": 1,
          "type": "array",
          "items": {
            "type": "object",
            "properties": {
              "quarter": {
                "type": "integer",
                "minimum": 1,
                "maximum": 4
              },
              "due": {
                "type": "string",
                "pattern": "^\\d{4}-\\d{2}-\\d{2}$"
              },
              "src": {
                "type": "string",
                "minLength": 1
              }
            },
            "required": [
              "quarter",
              "due",
              "src"
            ],
            "additionalProperties": false
          }
        },
        "returnDueRule": {
          "type": "object",
          "properties": {
            "monthsAfterYearEnd": {
              "type": "integer",
              "exclusiveMinimum": 0,
              "maximum": 9007199254740991
            },
            "src": {
              "type": "string",
              "minLength": 1
            }
          },
          "required": [
            "monthsAfterYearEnd",
            "src"
          ],
          "additionalProperties": false
        }
      },
      "required": [
        "instalments",
        "returnDueRule"
      ],
      "additionalProperties": false
    }
  },
  "required": [
    "schemaVersion",
    "yearOfAssessment",
    "period",
    "status",
    "lastReviewed",
    "sources",
    "reliefs",
    "qualifyingPayments",
    "rateSchedules",
    "rateCaps",
    "conditions",
    "separatelyRated",
    "apit",
    "wht",
    "calendar"
  ],
  "additionalProperties": false,
  "$id": "https://github.com/tax-calculator/data/schema/tax-year.schema.json",
  "title": "Sri Lanka tax-year data file",
  "description": "Generated from src/lib/tax/schema.ts — do not hand-edit. Run `node scripts/generate-json-schema.mjs` to regenerate. Structural checks only: the cross-field rules (every src resolves to a sources key, band shape, period shape, rateCaps/conditions references) are enforced by the Zod schema at build time, not by this JSON Schema file."
}
